{
  "schemaVersion": 1,
  "item": "@shadcn/label",
  "wave": 1,
  "status": "integrated",
  "upstream": {
    "version": null,
    "files": {
      "ui/label/Label.vue": "sha256-aa17a20f1778c0e3fae4ec961ecbcad7745f00fffcd769234db10ba841b38a1a",
      "ui/label/index.ts": "sha256-66c26173360bc6213b18473375aaa22debd4cc493f26e5331a6087851ff03ec7"
    }
  },
  "requires": {
    "npmDependencies": [
      "@vueuse/core",
      "reka-ui",
      "vue"
    ],
    "undeclaredUpstreamDependencies": [
      "vue"
    ]
  },
  "dimensions": {
    "color": "bridge",
    "radius": "adapter-scope",
    "typography": "adapter-scope",
    "motion": "adapter-scope",
    "border": "unsupported",
    "elevation": "unsupported",
    "spacing": "unsupported",
    "density": "unsupported",
    "material": "unsupported"
  },
  "portal": "Does not teleport content.",
  "rtl": "supported",
  "reducedMotion": "supported",
  "coverage": {
    "visual": false,
    "interaction": false,
    "staticConformance": true
  },
  "limitations": [
    "Control heights stay on the upstream scale; Balsa density is not a Tailwind grid unit.",
    "Type scale stays on the upstream scale; Balsa defines no numeric type scale.",
    "The Glass material is not applied; material direction is a composition decision."
  ]
}
