{
  "schemaVersion": 1,
  "item": "@shadcn/switch",
  "wave": 1,
  "status": "integrated-with-patch",
  "upstream": {
    "version": null,
    "files": {
      "ui/switch/Switch.vue": "sha256-7e692f91448cb3be4810abc18a27f73821e80d32582e5cd401c5213f046f26f5",
      "ui/switch/index.ts": "sha256-77041a4a0e966168bb9dc8def328d4b2658d49ec3d4fb584c7cdb8878254a275"
    }
  },
  "requires": {
    "npmDependencies": [
      "@vueuse/core",
      "reka-ui",
      "vue"
    ],
    "undeclaredUpstreamDependencies": [
      "vue"
    ]
  },
  "dimensions": {
    "color": "bridge",
    "radius": "adapter-scope",
    "typography": "adapter-scope",
    "motion": "adapter-scope",
    "border": "unsupported",
    "elevation": "patch",
    "spacing": "unsupported",
    "density": "unsupported",
    "material": "unsupported"
  },
  "patches": [
    {
      "file": "ui/switch/Switch.vue",
      "find": "'peer inline-flex h-5 w-9 shrink-0 cursor-pointer items-center rounded-full border-2 border-transparent shadow-sm transition-colors focus-visible:outline-none focus-visible:ring-2 focus-visible:ring-ring focus-visible:ring-offset-2 focus-visible:ring-offset-background disabled:cursor-not-allowed disabled:opacity-50 data-[state=checked]:bg-primary data-[state=unchecked]:bg-input'",
      "replace": "'peer inline-flex h-5 w-9 shrink-0 cursor-pointer items-center rounded-full border-2 border-transparent shadow-[var(--balsa-shadow-control)] transition-colors focus-visible:outline-none focus-visible:ring-2 focus-visible:ring-ring focus-visible:ring-offset-2 focus-visible:ring-offset-background disabled:cursor-not-allowed disabled:opacity-50 data-[state=checked]:bg-primary data-[state=unchecked]:bg-input motion-reduce:transition-none motion-reduce:animate-none'",
      "reason": "Tailwind shadow utilities compile to literal offsets, so elevation cannot reach through a variable. Animating without a reduced-motion guard ignores the user's stated preference."
    },
    {
      "file": "ui/switch/Switch.vue",
      "find": "'pointer-events-none block h-4 w-4 rounded-full bg-background shadow-lg ring-0 transition-transform data-[state=checked]:translate-x-4 data-[state=unchecked]:translate-x-0'",
      "replace": "'pointer-events-none block h-4 w-4 rounded-full bg-background shadow-[var(--balsa-shadow-lg)] ring-0 transition-transform data-[state=checked]:translate-x-4 data-[state=unchecked]:translate-x-0 motion-reduce:transition-none motion-reduce:animate-none'",
      "reason": "Tailwind shadow utilities compile to literal offsets, so elevation cannot reach through a variable. Animating without a reduced-motion guard ignores the user's stated preference."
    }
  ],
  "portal": "Does not teleport content.",
  "rtl": "supported",
  "reducedMotion": "supported",
  "coverage": {
    "visual": false,
    "interaction": false,
    "staticConformance": true
  },
  "limitations": [
    "Control heights stay on the upstream scale; Balsa density is not a Tailwind grid unit.",
    "Type scale stays on the upstream scale; Balsa defines no numeric type scale.",
    "The Glass material is not applied; material direction is a composition decision."
  ]
}
