{
  "schemaVersion": 1,
  "item": "@shadcn/toggle",
  "wave": 1,
  "status": "integrated-with-patch",
  "upstream": {
    "version": null,
    "files": {
      "ui/toggle/Toggle.vue": "sha256-f826a6ad4fa809d09cc4bb41765d7eaa6b31d8982b6468bc4bbd143cb9a527bf",
      "ui/toggle/index.ts": "sha256-ab39658251f15f464e7fc66d6d0b6bbccf949769fd4cbe45b760bfd0f949d6c7"
    }
  },
  "requires": {
    "npmDependencies": [
      "@vueuse/core",
      "class-variance-authority",
      "reka-ui",
      "vue"
    ],
    "undeclaredUpstreamDependencies": [
      "class-variance-authority",
      "vue"
    ]
  },
  "dimensions": {
    "color": "bridge",
    "radius": "adapter-scope",
    "typography": "adapter-scope",
    "motion": "adapter-scope",
    "border": "patch",
    "elevation": "patch",
    "spacing": "patch",
    "density": "unsupported",
    "material": "unsupported"
  },
  "patches": [
    {
      "file": "ui/toggle/index.ts",
      "find": "\"inline-flex items-center justify-center gap-2 rounded-md text-sm font-medium transition-colors hover:bg-muted hover:text-muted-foreground focus-visible:outline-none focus-visible:ring-1 focus-visible:ring-ring disabled:pointer-events-none disabled:opacity-50 data-[state=on]:bg-accent data-[state=on]:text-accent-foreground [&_svg]:pointer-events-none [&_svg]:size-4 [&_svg]:shrink-0\"",
      "replace": "\"inline-flex items-center justify-center gap-balsa-xs rounded-md text-sm font-medium transition-colors hover:bg-muted hover:text-muted-foreground focus-visible:outline-none focus-visible:ring-1 focus-visible:ring-ring disabled:pointer-events-none disabled:opacity-50 data-[state=on]:bg-accent data-[state=on]:text-accent-foreground [&_svg]:pointer-events-none [&_svg]:size-4 [&_svg]:shrink-0 motion-reduce:transition-none motion-reduce:animate-none\"",
      "reason": "A fixed Tailwind spacing step cannot follow the design system's spacing scale; the Balsa step carries the same value and derives from the base unit. Animating without a reduced-motion guard ignores the user's stated preference."
    },
    {
      "file": "ui/toggle/index.ts",
      "find": "\"border border-input bg-transparent shadow-sm hover:bg-accent hover:text-accent-foreground\"",
      "replace": "\"border-solid border-(length:--balsa-outline-border-width) border-input bg-transparent shadow-[var(--balsa-shadow-control)] hover:bg-accent hover:text-accent-foreground\"",
      "reason": "Tailwind shadow utilities compile to literal offsets, so elevation cannot reach through a variable."
    },
    {
      "file": "ui/toggle/index.ts",
      "find": "\"h-9 px-2 min-w-9\"",
      "replace": "\"h-9 px-balsa-xs min-w-9\"",
      "reason": "A fixed Tailwind spacing step cannot follow the design system's spacing scale; the Balsa step carries the same value and derives from the base unit."
    },
    {
      "file": "ui/toggle/index.ts",
      "find": "\"h-8 px-1.5 min-w-8\"",
      "replace": "\"h-8 px-balsa-2xs min-w-8\"",
      "reason": "A fixed Tailwind spacing step cannot follow the design system's spacing scale; the Balsa step carries the same value and derives from the base unit."
    },
    {
      "file": "ui/toggle/index.ts",
      "find": "\"h-10 px-2.5 min-w-10\"",
      "replace": "\"h-10 px-balsa-sm min-w-10\"",
      "reason": "A fixed Tailwind spacing step cannot follow the design system's spacing scale; the Balsa step carries the same value and derives from the base unit."
    }
  ],
  "portal": "Does not teleport content.",
  "rtl": "supported",
  "reducedMotion": "supported",
  "coverage": {
    "visual": false,
    "interaction": false,
    "staticConformance": true
  },
  "limitations": [
    "Control heights stay on the upstream scale; Balsa density is not a Tailwind grid unit.",
    "Type scale stays on the upstream scale; Balsa defines no numeric type scale.",
    "The Glass material is not applied; material direction is a composition decision."
  ]
}
