{
  "schemaVersion": 1,
  "item": "@shadcn/spinner",
  "wave": 2,
  "status": "integrated",
  "upstream": {
    "version": null,
    "files": {
      "ui/spinner/Spinner.vue": "sha256-7f38948374b7a28dc27e130e1f2a8d1368ae5b3a9768c832d756e6ce60858f87",
      "ui/spinner/index.ts": "sha256-cc089f08a8d333f85a011c1d20975e5976b9d9bfb4c14f3a416dd713adaa746b"
    }
  },
  "requires": {
    "npmDependencies": [
      "lucide-vue-next",
      "vue"
    ],
    "undeclaredUpstreamDependencies": [
      "lucide-vue-next",
      "vue"
    ]
  },
  "dimensions": {
    "color": "bridge",
    "radius": "adapter-scope",
    "typography": "adapter-scope",
    "motion": "adapter-scope",
    "border": "unsupported",
    "elevation": "unsupported",
    "spacing": "unsupported",
    "density": "unsupported",
    "material": "unsupported"
  },
  "portal": "Does not teleport content.",
  "rtl": "supported",
  "reducedMotion": "unsupported",
  "findings": [
    "Animates in 1 place(s) with no motion-reduce guard, so a reduced-motion preference is ignored."
  ],
  "coverage": {
    "visual": false,
    "interaction": false,
    "staticConformance": true
  },
  "limitations": [
    "Control heights stay on the upstream scale; Balsa density is not a Tailwind grid unit.",
    "Type scale stays on the upstream scale; Balsa defines no numeric type scale.",
    "The Glass material is not applied; material direction is a composition decision."
  ]
}
