{
  "schemaVersion": 1,
  "item": "@shadcn/separator",
  "wave": 2,
  "status": "integrated",
  "upstream": {
    "version": null,
    "files": {
      "ui/separator/Separator.vue": "sha256-9b849a19d8ee216292f67827ffc27db79ebf05b03974bec82ec01ece44d0fa32",
      "ui/separator/index.ts": "sha256-fcd7839dc204de276f98b80a4ccdb58c7d7494f64389c682312d3490e01b9025"
    }
  },
  "requires": {
    "npmDependencies": [
      "@vueuse/core",
      "reka-ui",
      "vue"
    ],
    "undeclaredUpstreamDependencies": [
      "vue"
    ]
  },
  "dimensions": {
    "color": "bridge",
    "radius": "adapter-scope",
    "typography": "adapter-scope",
    "motion": "adapter-scope",
    "border": "unsupported",
    "elevation": "unsupported",
    "spacing": "unsupported",
    "density": "unsupported",
    "material": "unsupported"
  },
  "portal": "Does not teleport content.",
  "rtl": "supported",
  "reducedMotion": "supported",
  "coverage": {
    "visual": false,
    "interaction": false,
    "staticConformance": true
  },
  "limitations": [
    "Control heights stay on the upstream scale; Balsa density is not a Tailwind grid unit.",
    "Type scale stays on the upstream scale; Balsa defines no numeric type scale.",
    "The Glass material is not applied; material direction is a composition decision."
  ]
}
