{
  "schemaVersion": 1,
  "item": "@shadcn/sheet",
  "wave": 3,
  "status": "integrated-with-patch",
  "upstream": {
    "version": null,
    "files": {
      "ui/sheet/Sheet.vue": "sha256-3c912cb3568b847099f095e167ea7f2dc17da24ddb7c8fd745eeb7062347fe76",
      "ui/sheet/SheetClose.vue": "sha256-5bb3674d4f7d0da01821f55045ecce5cf09d37d8fe843f2f8942919375a615b3",
      "ui/sheet/SheetContent.vue": "sha256-cd46e8e4c2c24479c61971c7995d45c1a01debb50f39c951b91e5dbf6081c4b8",
      "ui/sheet/SheetDescription.vue": "sha256-c4378bbebc308c438c7047356b7872dbb33549208edf9a3df80fc9633c509625",
      "ui/sheet/SheetFooter.vue": "sha256-463a1e673d0c0b7db83aca45a1e7956785c0bb428dbb22d8ba61d083b564caef",
      "ui/sheet/SheetHeader.vue": "sha256-514338808ea64a3682cb163455bbaad69428cfb775167760083a0367b26fe797",
      "ui/sheet/SheetTitle.vue": "sha256-191fa74dbd94a6e9b866ec76f1a50ff19ea292d37f7a9fc0db93d003b098e881",
      "ui/sheet/SheetTrigger.vue": "sha256-21cb17ea13635aa709ff79d95b4def1777448a58cd6effd9a45bd38435ea6589",
      "ui/sheet/index.ts": "sha256-77bad4208c0e08215f058648d059b398fc1eb6e962be8490e9125369ac1e9704"
    }
  },
  "requires": {
    "npmDependencies": [
      "@vueuse/core",
      "class-variance-authority",
      "lucide-vue-next",
      "reka-ui",
      "vue"
    ],
    "undeclaredUpstreamDependencies": [
      "class-variance-authority",
      "lucide-vue-next",
      "vue"
    ]
  },
  "dimensions": {
    "color": "bridge",
    "radius": "adapter-scope",
    "typography": "adapter-scope",
    "motion": "adapter-scope",
    "border": "unsupported",
    "elevation": "patch",
    "spacing": "patch",
    "density": "unsupported",
    "material": "unsupported"
  },
  "patches": [
    {
      "file": "ui/sheet/SheetContent.vue",
      "find": "\"fixed inset-0 z-50 bg-black/80 data-[state=open]:animate-in data-[state=closed]:animate-out data-[state=closed]:fade-out-0 data-[state=open]:fade-in-0\"",
      "replace": "\"fixed inset-0 z-50 bg-black/80 data-[state=open]:animate-in data-[state=closed]:animate-out data-[state=closed]:fade-out-0 data-[state=open]:fade-in-0 motion-reduce:transition-none motion-reduce:animate-none\"",
      "reason": "Animating without a reduced-motion guard ignores the user's stated preference."
    },
    {
      "file": "ui/sheet/SheetContent.vue",
      "find": "\"absolute right-4 top-4 rounded-sm opacity-70 ring-offset-background transition-opacity hover:opacity-100 focus:outline-none focus:ring-2 focus:ring-ring focus:ring-offset-2 disabled:pointer-events-none data-[state=open]:bg-secondary\"",
      "replace": "\"absolute end-4 top-4 rounded-sm opacity-70 ring-offset-background transition-opacity hover:opacity-100 focus:outline-none focus:ring-2 focus:ring-ring focus:ring-offset-2 disabled:pointer-events-none data-[state=open]:bg-secondary motion-reduce:transition-none motion-reduce:animate-none\"",
      "reason": "Physical-direction utilities do not mirror in RTL; their logical equivalents resolve identically in LTR. Animating without a reduced-motion guard ignores the user's stated preference."
    },
    {
      "file": "ui/sheet/SheetHeader.vue",
      "find": "'flex flex-col gap-y-2 text-center sm:text-left'",
      "replace": "'flex flex-col gap-y-balsa-xs text-center sm:text-start'",
      "reason": "A fixed Tailwind spacing step cannot follow the design system's spacing scale; the Balsa step carries the same value and derives from the base unit. Physical-direction utilities do not mirror in RTL; their logical equivalents resolve identically in LTR."
    },
    {
      "file": "ui/sheet/index.ts",
      "find": "\"fixed z-50 gap-4 bg-background p-6 shadow-lg transition ease-in-out data-[state=open]:animate-in data-[state=closed]:animate-out data-[state=closed]:duration-300 data-[state=open]:duration-500\"",
      "replace": "\"fixed z-50 gap-balsa-lg bg-background p-balsa-2xl shadow-[var(--balsa-shadow-lg)] transition ease-in-out data-[state=open]:animate-in data-[state=closed]:animate-out data-[state=closed]:duration-300 data-[state=open]:duration-500 motion-reduce:transition-none motion-reduce:animate-none\"",
      "reason": "Tailwind shadow utilities compile to literal offsets, so elevation cannot reach through a variable. Animating without a reduced-motion guard ignores the user's stated preference."
    },
    {
      "file": "ui/sheet/index.ts",
      "find": "\"inset-y-0 left-0 h-full w-3/4 border-r data-[state=closed]:slide-out-to-left data-[state=open]:slide-in-from-left sm:max-w-sm\"",
      "replace": "\"inset-y-0 start-0 h-full w-3/4 border-e data-[state=closed]:slide-out-to-left data-[state=open]:slide-in-from-left sm:max-w-sm\"",
      "reason": "Physical-direction utilities do not mirror in RTL; their logical equivalents resolve identically in LTR."
    },
    {
      "file": "ui/sheet/index.ts",
      "find": "\"inset-y-0 right-0 h-full w-3/4 border-l data-[state=closed]:slide-out-to-right data-[state=open]:slide-in-from-right sm:max-w-sm\"",
      "replace": "\"inset-y-0 end-0 h-full w-3/4 border-s data-[state=closed]:slide-out-to-right data-[state=open]:slide-in-from-right sm:max-w-sm\"",
      "reason": "Physical-direction utilities do not mirror in RTL; their logical equivalents resolve identically in LTR."
    }
  ],
  "portal": "Teleports content. The adapter scope does not follow a teleport, so put data-balsa-adapt on the teleport target as well as the application root.",
  "rtl": "supported",
  "reducedMotion": "supported",
  "coverage": {
    "visual": false,
    "interaction": false,
    "staticConformance": true
  },
  "limitations": [
    "Control heights stay on the upstream scale; Balsa density is not a Tailwind grid unit.",
    "Type scale stays on the upstream scale; Balsa defines no numeric type scale.",
    "The Glass material is not applied; material direction is a composition decision."
  ]
}
