{
  "schemaVersion": 1,
  "item": "@shadcn/aspect-ratio",
  "wave": 2,
  "status": "integrated",
  "upstream": {
    "version": null,
    "files": {
      "ui/aspect-ratio/AspectRatio.vue": "sha256-dbc8d866b1fad3f8bd15d5613bbff662738ca3d6cf34ec13b9ce261b45ba4e24",
      "ui/aspect-ratio/index.ts": "sha256-d9804f2ace298fab7e640f2c86d145b71845739420eaf054e39bfcd210ed2c12"
    }
  },
  "requires": {
    "npmDependencies": [
      "reka-ui"
    ]
  },
  "dimensions": {
    "color": "bridge",
    "radius": "adapter-scope",
    "typography": "adapter-scope",
    "motion": "adapter-scope",
    "border": "unsupported",
    "elevation": "unsupported",
    "spacing": "unsupported",
    "density": "unsupported",
    "material": "unsupported"
  },
  "portal": "Does not teleport content.",
  "rtl": "supported",
  "reducedMotion": "supported",
  "coverage": {
    "visual": false,
    "interaction": false,
    "staticConformance": true
  },
  "limitations": [
    "Control heights stay on the upstream scale; Balsa density is not a Tailwind grid unit.",
    "Type scale stays on the upstream scale; Balsa defines no numeric type scale.",
    "The Glass material is not applied; material direction is a composition decision."
  ]
}
