{
  "schemaVersion": 1,
  "item": "@shadcn/progress",
  "wave": 2,
  "status": "integrated-with-patch",
  "upstream": {
    "version": null,
    "files": {
      "ui/progress/Progress.vue": "sha256-ca82d508bd8aa4b5182aae5dff0b80e0c9182ce25a0bbb2671554f9fd1b5c46c",
      "ui/progress/index.ts": "sha256-c7a63e05c3f5851c0f7be1a91d57062aa833448ac649d7b974f43ac66bd54e96"
    }
  },
  "requires": {
    "npmDependencies": [
      "@vueuse/core",
      "reka-ui",
      "vue"
    ],
    "undeclaredUpstreamDependencies": [
      "vue"
    ]
  },
  "dimensions": {
    "color": "bridge",
    "radius": "adapter-scope",
    "typography": "adapter-scope",
    "motion": "adapter-scope",
    "border": "unsupported",
    "elevation": "unsupported",
    "spacing": "unsupported",
    "density": "unsupported",
    "material": "unsupported"
  },
  "patches": [
    {
      "file": "ui/progress/Progress.vue",
      "find": "\"h-full w-full flex-1 bg-primary transition-all\"",
      "replace": "\"h-full w-full flex-1 bg-primary transition-all motion-reduce:transition-none motion-reduce:animate-none\"",
      "reason": "Animating without a reduced-motion guard ignores the user's stated preference."
    }
  ],
  "portal": "Does not teleport content.",
  "rtl": "supported",
  "reducedMotion": "supported",
  "coverage": {
    "visual": false,
    "interaction": false,
    "staticConformance": true
  },
  "limitations": [
    "Control heights stay on the upstream scale; Balsa density is not a Tailwind grid unit.",
    "Type scale stays on the upstream scale; Balsa defines no numeric type scale.",
    "The Glass material is not applied; material direction is a composition decision."
  ]
}
