{
  "schemaVersion": 1,
  "item": "@shadcn/collapsible",
  "wave": 4,
  "status": "integrated-with-patch",
  "upstream": {
    "version": null,
    "files": {
      "ui/collapsible/Collapsible.vue": "sha256-3f937a7cfd8a99790512157a34c140d9ff1887d92e8f64998521fdf7d2946100",
      "ui/collapsible/CollapsibleContent.vue": "sha256-18105ce27b2c1b8f5cc6c05e41b477a4f6ed219409aa8f0a752be9ef511fd715",
      "ui/collapsible/CollapsibleTrigger.vue": "sha256-455728ecb443a8165ac55d6edfe8aac1865d8dcd02ea1c35d05942a5d13e4084",
      "ui/collapsible/index.ts": "sha256-a34935867d65ede4cf683d8aa763a7983c089ae1dea8e82699fe3b34b8743592"
    }
  },
  "requires": {
    "npmDependencies": [
      "reka-ui"
    ]
  },
  "dimensions": {
    "color": "bridge",
    "radius": "adapter-scope",
    "typography": "adapter-scope",
    "motion": "adapter-scope",
    "border": "unsupported",
    "elevation": "unsupported",
    "spacing": "unsupported",
    "density": "unsupported",
    "material": "unsupported"
  },
  "patches": [
    {
      "file": "ui/collapsible/CollapsibleContent.vue",
      "find": "\"overflow-hidden transition-all data-[state=closed]:animate-collapsible-up data-[state=open]:animate-collapsible-down\"",
      "replace": "\"overflow-hidden transition-all data-[state=closed]:animate-collapsible-up data-[state=open]:animate-collapsible-down motion-reduce:transition-none motion-reduce:animate-none\"",
      "reason": "Animating without a reduced-motion guard ignores the user's stated preference."
    }
  ],
  "portal": "Does not teleport content.",
  "rtl": "supported",
  "reducedMotion": "supported",
  "coverage": {
    "visual": false,
    "interaction": false,
    "staticConformance": true
  },
  "limitations": [
    "Control heights stay on the upstream scale; Balsa density is not a Tailwind grid unit.",
    "Type scale stays on the upstream scale; Balsa defines no numeric type scale.",
    "The Glass material is not applied; material direction is a composition decision."
  ]
}
