{
  "schemaVersion": 1,
  "item": "@shadcn/kbd",
  "wave": 2,
  "status": "integrated-with-patch",
  "upstream": {
    "version": null,
    "files": {
      "ui/kbd/Kbd.vue": "sha256-21bcc33c8f6d71a7d41ea7b875036295c1fc6ca8432a2cb578dc7116a7d100eb",
      "ui/kbd/KbdGroup.vue": "sha256-5eff150806b9fb08f9de8e0e13a53b6efbe89cbb17fa38e03d6f7a5cd43aac97",
      "ui/kbd/index.ts": "sha256-89a33e8b347ad2b0593b090aa9584b21093058ddd591c5403f47d5c1c1e4eb51"
    }
  },
  "requires": {
    "npmDependencies": [
      "vue"
    ],
    "undeclaredUpstreamDependencies": [
      "vue"
    ]
  },
  "dimensions": {
    "color": "bridge",
    "radius": "adapter-scope",
    "typography": "adapter-scope",
    "motion": "adapter-scope",
    "border": "unsupported",
    "elevation": "unsupported",
    "spacing": "patch",
    "density": "unsupported",
    "material": "unsupported"
  },
  "patches": [
    {
      "file": "ui/kbd/Kbd.vue",
      "find": "'bg-muted text-muted-foreground pointer-events-none inline-flex h-5 w-fit min-w-5 items-center justify-center gap-1 rounded-sm px-1 font-sans text-xs font-medium select-none'",
      "replace": "'bg-muted text-muted-foreground pointer-events-none inline-flex h-5 w-fit min-w-5 items-center justify-center gap-balsa-3xs rounded-sm px-balsa-3xs font-sans text-xs font-medium select-none'",
      "reason": "A fixed Tailwind spacing step cannot follow the design system's spacing scale; the Balsa step carries the same value and derives from the base unit."
    },
    {
      "file": "ui/kbd/KbdGroup.vue",
      "find": "'inline-flex items-center gap-1'",
      "replace": "'inline-flex items-center gap-balsa-3xs'",
      "reason": "A fixed Tailwind spacing step cannot follow the design system's spacing scale; the Balsa step carries the same value and derives from the base unit."
    }
  ],
  "portal": "Does not teleport content.",
  "rtl": "supported",
  "reducedMotion": "supported",
  "coverage": {
    "visual": false,
    "interaction": false,
    "staticConformance": true
  },
  "limitations": [
    "Control heights stay on the upstream scale; Balsa density is not a Tailwind grid unit.",
    "Type scale stays on the upstream scale; Balsa defines no numeric type scale.",
    "The Glass material is not applied; material direction is a composition decision."
  ]
}
